{
  "$schema": "https://json-schema.org/draft/2020-12/schema",
  "$id": "https://pcs.sentinelops.ci/schemas/VerifierAssuranceReport.v1.schema.json",
  "title": "VerifierAssuranceReport.v1",
  "description": "Deterministic assurance report aggregating FAR/FRR/abstention, adjudication coverage, optimization gap, and related metrics with declared CI methods.",
  "type": "object",
  "required": [
    "schema_version",
    "artifact_type",
    "report_id",
    "created_at",
    "producer",
    "producer_version",
    "source_repo",
    "source_commit",
    "campaign_ref",
    "release_grade",
    "metrics",
    "cohorts",
    "excluded_items",
    "unadjudicated_items",
    "applicability_limits",
    "integrity"
  ],
  "additionalProperties": false,
  "properties": {
    "schema_version": { "$ref": "common.defs.json#/$defs/schema_version_v1" },
    "artifact_type": { "const": "VerifierAssuranceReport.v1" },
    "report_id": { "type": "string", "minLength": 1 },
    "created_at": { "$ref": "common.defs.json#/$defs/iso8601_datetime" },
    "producer": { "type": "string", "minLength": 1 },
    "producer_version": { "type": "string", "minLength": 1 },
    "source_repo": { "type": "string", "format": "uri" },
    "source_commit": { "$ref": "verifier_assurance.defs.json#/$defs/git_commit_sha40" },
    "campaign_ref": { "$ref": "verifier_assurance.defs.json#/$defs/artifact_ref" },
    "preregistration_ref": { "type": "string", "minLength": 1 },
    "release_grade": { "type": "boolean" },
    "independent_adjudication": { "type": "boolean" },
    "metrics": {
      "type": "object",
      "required": [
        "false_accept_rate",
        "false_reject_rate",
        "abstention_rate",
        "adjudication_coverage",
        "ordinary_accept_rate",
        "optimized_accept_rate",
        "optimization_gap",
        "time_to_first_exploit_seconds",
        "queries_to_first_exploit",
        "exploit_family_counts",
        "inter_verifier_disagreement_rate",
        "reward_invalidation_rate",
        "latency_ms_p50",
        "cost_decimal",
        "sample_size",
        "excluded_count",
        "unadjudicated_count"
      ],
      "additionalProperties": false,
      "properties": {
        "false_accept_rate": { "$ref": "verifier_assurance.defs.json#/$defs/rate_with_ci" },
        "false_reject_rate": { "$ref": "verifier_assurance.defs.json#/$defs/rate_with_ci" },
        "abstention_rate": { "$ref": "verifier_assurance.defs.json#/$defs/rate_with_ci" },
        "adjudication_coverage": { "$ref": "verifier_assurance.defs.json#/$defs/rate_with_ci" },
        "ordinary_accept_rate": { "$ref": "verifier_assurance.defs.json#/$defs/rate_with_ci" },
        "optimized_accept_rate": { "$ref": "verifier_assurance.defs.json#/$defs/rate_with_ci" },
        "optimization_gap": { "$ref": "verifier_assurance.defs.json#/$defs/decimal_string" },
        "time_to_first_exploit_seconds": {
          "oneOf": [
            { "type": "integer", "minimum": 0 },
            { "type": "null" }
          ]
        },
        "queries_to_first_exploit": {
          "oneOf": [
            { "type": "integer", "minimum": 0 },
            { "type": "null" }
          ]
        },
        "exploit_family_counts": {
          "type": "object",
          "additionalProperties": { "type": "integer", "minimum": 0 }
        },
        "inter_verifier_disagreement_rate": {
          "$ref": "verifier_assurance.defs.json#/$defs/rate_with_ci"
        },
        "reward_invalidation_rate": {
          "$ref": "verifier_assurance.defs.json#/$defs/rate_with_ci"
        },
        "latency_ms_p50": { "type": "integer", "minimum": 0 },
        "cost_decimal": { "$ref": "verifier_assurance.defs.json#/$defs/non_negative_decimal_string" },
        "sample_size": { "type": "integer", "minimum": 0 },
        "excluded_count": { "type": "integer", "minimum": 0 },
        "unadjudicated_count": { "type": "integer", "minimum": 0 }
      }
    },
    "cohorts": {
      "type": "array",
      "items": {
        "type": "object",
        "required": [
          "cohort_id",
          "cohort_kind",
          "access_class",
          "compute_exposure",
          "included_result_count",
          "accept_count",
          "reject_count",
          "indeterminate_count"
        ],
        "additionalProperties": false,
        "properties": {
          "cohort_id": { "type": "string", "minLength": 1 },
          "cohort_kind": {
            "type": "string",
            "enum": ["ordinary", "optimized", "other"]
          },
          "access_class": { "$ref": "verifier_assurance.defs.json#/$defs/access_class" },
          "compute_exposure": {
            "type": "object",
            "required": ["accounting_method", "wall_time_seconds", "query_count"],
            "additionalProperties": false,
            "properties": {
              "accounting_method": { "type": "string", "minLength": 1 },
              "wall_time_seconds": { "type": "integer", "minimum": 0 },
              "query_count": { "type": "integer", "minimum": 0 }
            }
          },
          "included_result_count": { "type": "integer", "minimum": 0 },
          "accept_count": { "type": "integer", "minimum": 0 },
          "reject_count": { "type": "integer", "minimum": 0 },
          "indeterminate_count": { "type": "integer", "minimum": 0 },
          "stratification": { "type": "string" }
        }
      }
    },
    "excluded_items": {
      "type": "array",
      "items": {
        "type": "object",
        "required": ["item_id", "reason_code"],
        "additionalProperties": false,
        "properties": {
          "item_id": { "type": "string", "minLength": 1 },
          "reason_code": { "type": "string", "minLength": 1 }
        }
      }
    },
    "unadjudicated_items": {
      "type": "array",
      "items": {
        "type": "object",
        "required": ["item_id", "reason_code"],
        "additionalProperties": false,
        "properties": {
          "item_id": { "type": "string", "minLength": 1 },
          "reason_code": { "type": "string", "minLength": 1 }
        }
      }
    },
    "applicability_limits": {
      "type": "array",
      "items": { "type": "string", "minLength": 1 }
    },
    "integrity": { "$ref": "verifier_assurance.defs.json#/$defs/nested_integrity" },
    "signature_or_digest": {
      "$ref": "verifier_assurance.defs.json#/$defs/forbid_signature_or_digest"
    }
  }
}
